{
  "project_id": "prj_pelle_pv20_001",
  "components": [
    {
      "component_id": "Q2",
      "designator": "Q2",
      "type": "unknown_semiconductor",
      "package": "SOT-23",
      "pin_count": 3,
      "marking": "K72",
      "status": "needs_identification"
    }
  ],
  "pins": [
    {
      "component_id": "Q2",
      "pin_id": "Q2.1",
      "label": "unknown",
      "status": "user_confirmed_visual"
    },
    {
      "component_id": "Q2",
      "pin_id": "Q2.2",
      "label": null,
      "status": "unknown"
    },
    {
      "component_id": "Q2",
      "pin_id": "Q2.3",
      "label": null,
      "status": "unknown"
    }
  ],
  "measurements": [
    {
      "measurement_id": "M001",
      "mode": "continuity",
      "from": "Q2.1",
      "to": "R17.1",
      "reading": {
        "kind": "numeric",
        "value": 0.3,
        "unit": "ohm"
      },
      "power_state": "off",
      "origin_event_id": "evt_000006",
      "valid_from_event_id": "evt_000006",
      "valid_until_event_id": "evt_000007",
      "validity_status": "stale_after_repair"
    },
    {
      "measurement_id": "M002",
      "mode": "continuity",
      "from": "Q2.1",
      "to": "R17.1",
      "reading": {
        "kind": "numeric",
        "value": 0.2,
        "unit": "ohm"
      },
      "power_state": "off",
      "origin_event_id": "evt_000008",
      "valid_from_event_id": "evt_000008",
      "valid_until_event_id": null,
      "validity_status": "active"
    }
  ],
  "nets": [
    {
      "net_id": "N1",
      "from": "Q2.1",
      "to": "R17.1",
      "confirmation_basis": "measured",
      "confirmed_by_event_ids": [
        "evt_000008"
      ],
      "label": "post-repair continuity",
      "verification_level": "measured"
    }
  ],
  "excluded_from_fault_candidates": [
    {
      "footprint_id": "K1",
      "designator": "K1"
    },
    {
      "footprint_id": "K2",
      "designator": "K2"
    },
    {
      "footprint_id": "K3",
      "designator": "K3"
    }
  ]
}
